{
  "$schema": "https://agentrig.dev/schema/pack.json",
  "kind": "agentrig:pack",
  "name": "core-committer",
  "title": "Committer skill",
  "description": "Adds a committer skill with a safe commit helper script.",
  "version": "0.1.0",
  "author": "agentrig",
  "tags": [
    "git",
    "workflow",
    "core"
  ],
  "files": [
    {
      "path": "packs/core-committer/skills/pr-commiter/SKILL.md",
      "target": "{{skillsDir}}/pr-commiter/SKILL.md",
      "sha256": "79295bed40b20da9c55d6e55855a9234e303b89fd171c0b87a30141ccef829fb"
    },
    {
      "path": "packs/core-committer/skills/pr-commiter/scripts/pr-commiter.sh",
      "target": "{{skillsDir}}/pr-commiter/scripts/pr-commiter.sh",
      "mode": "755",
      "sha256": "101fd5e1897e4765e6759a8b7c839a7eaa84d7457784f60d2bb537fb5332d25f"
    }
  ]
}
