{
  "$schema": "https://agentrig.dev/schema/pack.json",
  "kind": "agentrig:pack",
  "name": "core-committer",
  "title": "Committer skill",
  "description": "Adds a committer skill with a safe commit helper script.",
  "version": "0.1.0",
  "author": "agentrig",
  "tags": [
    "git",
    "workflow",
    "core"
  ],
  "files": [
    {
      "path": "skills/pr-commiter/SKILL.md",
      "target": "{{skillsDir}}/pr-commiter/SKILL.md"
    },
    {
      "path": "skills/pr-commiter/scripts/pr-commiter.sh",
      "target": "{{skillsDir}}/pr-commiter/scripts/pr-commiter.sh",
      "mode": "755"
    }
  ]
}
