{
  "$schema": "https://agentrig.dev/schema/pack.json",
  "kind": "agentrig:pack",
  "name": "go",
  "title": "Go skill",
  "description": "Go quality checks: fmt, vet, tests.",
  "version": "0.1.0",
  "author": "agentrig",
  "tags": [
    "go"
  ],
  "files": [
    {
      "path": "skills/go/SKILL.md",
      "target": "{{skillsDir}}/go/SKILL.md"
    },
    {
      "path": "skills/go/go-check.sh",
      "target": "{{skillsDir}}/go/go-check.sh",
      "mode": "755"
    }
  ]
}
