{
  "$schema": "https://agentrig.dev/schema/pack.json",
  "kind": "agentrig:pack",
  "name": "go",
  "title": "Go skill",
  "description": "Go quality checks: fmt, vet, tests.",
  "version": "0.1.0",
  "author": "agentrig",
  "tags": [
    "go"
  ],
  "files": [
    {
      "path": "packs/go/skills/go/SKILL.md",
      "target": "{{skillsDir}}/go/SKILL.md",
      "sha256": "e103fb4cf7294d0dfbcb9b10ab7c7557d8bb074c46fa5499384cc5cc7544c018"
    },
    {
      "path": "packs/go/skills/go/go-check.sh",
      "target": "{{skillsDir}}/go/go-check.sh",
      "mode": "755",
      "sha256": "c514829f40877baf8a74a91bd09726026ca5cc91a48b0116e01519c721036070"
    }
  ]
}
