{
  "$schema": "https://agentrig.dev/schema/pack.json",
  "kind": "agentrig:pack",
  "name": "typescript",
  "title": "TypeScript skill",
  "description": "TypeScript patterns and guardrails for agentic coding.",
  "version": "0.1.0",
  "author": "agentrig",
  "tags": [
    "typescript"
  ],
  "files": [
    {
      "path": "skills/typescript/SKILL.md",
      "target": "{{skillsDir}}/typescript/SKILL.md"
    }
  ]
}
