{
  "$schema": "https://agentrig.dev/schema/pack.json",
  "kind": "agentrig:pack",
  "name": "solidjs",
  "title": "SolidJS skill",
  "description": "SolidJS patterns and guardrails for agentic coding.",
  "version": "0.1.0",
  "author": "agentrig",
  "tags": [
    "solidjs",
    "frontend"
  ],
  "files": [
    {
      "path": "skills/solidjs/SKILL.md",
      "target": "{{skillsDir}}/solidjs/SKILL.md"
    }
  ]
}
