{
  "$schema": "https://agentrig.ai/schema/pack.json",
  "kind": "agentrig:pack",
  "name": "security-check",
  "title": "Security check skill",
  "description": "Adds a security check skill that runs lightweight checks before shipping.",
  "version": "0.1.0",
  "author": "agentrig",
  "tags": [
    "security",
    "workflow",
    "core"
  ],
  "files": [
    {
      "path": "packs/security-check/skills/security-check/SKILL.md",
      "target": "{{skillsDir}}/security-check/SKILL.md",
      "sha256": "b0ed321cae08a5b4192562495fe66aaccdd5f141ff102d9104b970bd38ff1423"
    },
    {
      "path": "packs/security-check/skills/security-check/security-check.sh",
      "target": "{{skillsDir}}/security-check/security-check.sh",
      "mode": "755",
      "sha256": "e67261ff66c6fedb535b8fc8fab4e020196f6a619ce07af5ed770138f8558b2f"
    }
  ]
}
